{"archive":{"archive_prefix":"JobFlow-v0.7.0-windows-x64/","bytes":38628522,"name":"JobFlow-v0.7.0-windows-x64-complete.zip","sha256":"sha256:707238221eb22e49eda62c5b4d7bb4221738b7c833ac7fe7fa4e9e6de80345a2"},"build_inputs_sha256":"sha256:133370a9399b3e092e36b56e69054697543f7cefcefe8de418ef030d65fc6793","format":"JOBFLOW_PROTECTED_PUBLISHER_REQUEST_V1","pinned_policy":{"release_key_id":"sha256:1037057f8578a60ac5b3dc030cb2d70ad945ec3b5fb51fa3944fcafa77146339","sigstore_certificate_identity":"thomas@python.org","sigstore_certificate_oidc_issuer":"https://accounts.google.com","update_channel_sha256":"sha256:73501b65eba1d0ce44de25bd105da9fd58901ab10eb95d685bd5fa46cae42289","windows_runtime_source_sha256":"sha256:cb2f3920a15a6b937f6bad6489ec1650a2bcbb87bad110ff4308b13e04e581c4"},"python_source":{"artifact_bytes":11009825,"artifact_name":"python-3.13.15-embed-amd64.zip","artifact_sha256":"sha256:d1f04d990aee1253d8569e8e5104e30fa9f5fa830899f14843448872d936a2cf","sigstore_bundle_bytes":7164,"sigstore_bundle_name":"python-3.13.15-embed-amd64.zip.sigstore","sigstore_bundle_sha256":"sha256:3e487c064a40d94a59476eb05e2d6225c325665590797e0a03cd33592b617137"},"release":{"platform":"windows-x64","source_commit":"987e8c58826a63cf629a3c84075cf95f725efe28","version":"0.7.0"},"required_response":{"format":"JOBFLOW_PUBLISHER_EVIDENCE_V1","maximum_bytes":262144,"name":"JobFlow-publisher-evidence.json","schema_name":"publisher-evidence-v1","signer_challenge_format":"JOBFLOW_SIGNER_READINESS_CHALLENGE_V1","status":"READY_FOR_PROTECTED_SIGNING"},"runtime_build_evidence":{"bytes":4128,"expires_at_utc":"2026-10-29T23:52:13Z","issued_at_utc":"2026-10-29T00:52:13Z","name":"JobFlow-runtime-build-evidence.json","sha256":"sha256:8d29f62761e04d692b6ef006bfd4c54793d4334d75484e4dc088175fb9ddd7fa"},"runtime_closure":{"file_count":1281,"manifest_sha256":"sha256:163fb0f0f4cf3881fac78fa9660ffa9223cdc0b3518cbaa0aee42a12f47e5e4f","source_payload_sha256":"sha256:707238221eb22e49eda62c5b4d7bb4221738b7c833ac7fe7fa4e9e6de80345a2","total_bytes":81296431,"tree_sha256":"sha256:d9ebaa31948864da0ea56ff57df30d5e9755567ebde70133c349f74fc34df341"},"safety":{"external_actions":0,"protected_key_required_by_request":false,"request_contains_local_paths":false,"request_contains_secret_material":false},"schema_version":1,"status":"AWAITING_PROTECTED_PUBLISHER_EVIDENCE"}